<?xml version="1.0" encoding="utf-8"?>
<webspace xmlns="http://schemas.sulu.io/webspace/webspace"
           xmlns:xsi="http://www.w3.org/2001/XMLSchema-instance"
           xsi:schemaLocation="http://schemas.sulu.io/webspace/webspace http://schemas.sulu.io/webspace/webspace-1.0.xsd">

    <name>Sulu CMF</name>
    <key>sulu_io</key>

    <localizations>
        <localization language="en"/>
        <localization language="de"/>
    </localizations>

    <theme>
        <key>default</key>
        <default-templates>
            <default-template type="page">default</default-template>
            <default-template type="homepage">overview</default-template>
        </default-templates>
    </theme>

    <navigation>
        <contexts>
            <context key="main">
                <meta>
                    <title lang="de">Hauptnavigation</title>
                    <title lang="en">Mainnavigation</title>
                </meta>
            </context>
            <context key="footer">
                <meta>
                    <title lang="de">Footernavigation</title>
                    <title lang="en">Footernavigation</title>
                </meta>
            </context>
        </contexts>
    </navigation>

    <portals>
        <portal>
            <name>Sulu CMF AT</name>
            <key>sulucmf_at</key>
            <resource-locator>
                <strategy>tree</strategy>
            </resource-locator>

            <localizations>
                <localization language="en" default="true" />
                <localization language="de" />
            </localizations>

            <environments>
                <environment type="prod">
                    <urls>
                        <url>sulu.lo/{localization}</url>
                    </urls>
                </environment>
                <environment type="dev">
                    <urls>
                        <url>sulu.lo/{localization}</url>
                    </urls>
                </environment>
                <environment type="test">
                    <urls>
                        <url>sulu.lo/{localization}</url>
                    </urls>
                </environment>
            </environments>
        </portal>
    </portals>
</webspace>
