<?xml version="1.0" encoding="utf-8"?>
<webspace xmlns="http://schemas.sulu.io/webspace/webspace"
          xmlns:xsi="http://www.w3.org/2001/XMLSchema-instance"
          xsi:schemaLocation="http://schemas.sulu.io/webspace/webspace http://schemas.sulu.io/webspace/webspace-1.0.xsd">

    <name>sulu.io</name>
    <key>sulu_io</key>

    <localizations>
        <localization language="en" shadow="auto">
            <localization language="en" country="us" shadow="auto"/>
        </localization>
        <localization language="de">
            <localization language="de" country="at"/>
        </localization>
    </localizations>

    <theme>
        <key>default</key>
        <default-templates>
            <default-template type="page">default</default-template>
            <default-template type="homepage">default</default-template>
        </default-templates>
    </theme>

    <navigation>
        <contexts>
            <context key="main">
                <meta>
                    <title lang="de">Hauptnavigation</title>
                    <title lang="en">Mainnavigation</title>
                </meta>
            </context>
            <context key="footer">
                <meta>
                    <title lang="de">Footernavigation</title>
                    <title lang="en">Footernavigation</title>
                </meta>
            </context>
        </contexts>
    </navigation>

    <portals>
        <portal>
            <name>sulu.io</name>
            <key>sulu_io</key>
            <resource-locator>
                <strategy>tree</strategy>
            </resource-locator>

            <localizations>
                <localization language="en" default="true"/>
                <localization language="de"/>
            </localizations>

            <environments>
                <environment type="prod">
                    <urls>
                        <url language="en">sulu.us</url>
                        <url language="de">www.sulu.io</url>
                        <url>sulu.lo/{localization}</url>
                    </urls>
                </environment>
                <environment type="stage">
                    <urls>
                        <url>stage.sulu.lo/{localization}</url>
                        <url>sulu.lo/{localization}</url>
                    </urls>
                </environment>
                <environment type="dev">
                    <urls>
                        <url>sulu.lo/{localization}</url>
                        <url language="en">localhost</url>
                    </urls>
                </environment>
            </environments>
        </portal>
    </portals>
</webspace>
